{
  "verdict": "changes_requested",
  "candidate_ref": "art_01JBC7S1A2B3C4D5E6F7G8H9JK",
  "summary": "汇总口径有一处问题，需要修改后再审。",
  "findings": [
    {
      "id": "f1",
      "severity": "major",
      "location": "summary.csv，2026-08，华东",
      "text": "该组合计比明细少了 3 行退款记录：负数金额被过滤掉了，与说明中'退款计入汇总'不一致。",
      "suggestion": "汇总时不要过滤负数金额。"
    }
  ],
  "evidence": [
    {
      "check": "按地区重新求和对比",
      "result": "fail",
      "detail": "华东 2026-08：汇总 1,203,445.10，明细 1,201,987.30"
    }
  ],
  "request_id": "req_01JBC7Q5W8M2N3P4R5S6T7V8X9",
  "task_id": "tsk_01JBC7Q5W8M2N3P4R5S6T7V8X9",
  "requirements_revision": 2,
  "plan_revision": 2,
  "task_revision": 2,
  "instruction_revision": 2,
  "dispatcher_epoch": 1,
  "review_id": "review_01JBC7Q5W8M2N3P4R5S6T7V8X9",
  "submission_id": "sub_01JBC7Q5W8M2N3P4R5S6T7V8X9",
  "candidate_sha256": "bbbbbbbbbbbbbbbbbbbbbbbbbbbbbbbbbbbbbbbbbbbbbbbbbbbbbbbbbbbbbbbb",
  "round": 1,
  "reviewer_instruction_revision": 1,
  "reviewer_request_id": "req_01JBC7S1A2B3C4D5E6F7G8H9JK",
  "reviewer_task_id": "tsk_01JBC7S1A2B3C4D5E6F7G8H9JK",
  "reviewer_team_id": "team_01JBC7S1A2B3C4D5E6F7G8H9JK",
  "reviewer_requirements_revision": 1,
  "reviewer_plan_revision": 1,
  "reviewer_task_revision": 1,
  "reviewer_dispatcher_epoch": 1,
  "reviewer_execution_epoch": 1,
  "reviewer_policy_epoch": 1
}
